{
  "$schema": "https://json-schema.org/draft/2020-12/schema",
  "title": "Astrid private Lean package validation profile V1",
  "type": "object",
  "additionalProperties": false,
  "required": ["schema_version", "task_id", "excluded_declarations", "reference_submission"],
  "properties": {
    "schema_version": {"type": "integer", "const": 1},
    "task_id": {"$ref": "#/$defs/taskId"},
    "excluded_declarations": {
      "type": "array",
      "uniqueItems": true,
      "items": {"type": "string", "pattern": "^[A-Za-z_][A-Za-z0-9_]*(?:\\.[A-Za-z_][A-Za-z0-9_]*)+$"},
      "description": "Declarations that must be absent from the complete public imported environment."
    },
    "reference_submission": {"$ref": "#/$defs/file"},
    "standalone_reference": {"$ref": "#/$defs/file"},
    "same_artefacts_as": {
      "type": "array",
      "items": {
        "type": "object",
        "additionalProperties": false,
        "required": ["task_id", "roles"],
        "properties": {
          "task_id": {"$ref": "#/$defs/taskId"},
          "roles": {
            "type": "array", "minItems": 1, "uniqueItems": true,
            "items": {"type": "string", "pattern": "^[a-z][a-z0-9_]*$"}
          }
        }
      }
    }
  },
  "$defs": {
    "taskId": {"type": "string", "pattern": "^task_[1-9][0-9]*\\.[1-9][0-9]*_[a-z][a-z0-9]*(?:_[a-z0-9]+)*$"},
    "file": {
      "type": "object", "additionalProperties": false, "required": ["path", "sha256"],
      "properties": {
        "path": {"type": "string", "pattern": "^[A-Za-z0-9][A-Za-z0-9._-]*(/[A-Za-z0-9][A-Za-z0-9._-]*)*$"},
        "sha256": {"type": "string", "pattern": "^[a-f0-9]{64}$"}
      }
    }
  }
}
